running extract_messages
extracting messages from invenio_accounts/__init__.py (encoding="utf-8")
extracting messages from invenio_accounts/admin.py (encoding="utf-8")
extracting messages from invenio_accounts/api.py (encoding="utf-8")
extracting messages from invenio_accounts/cli.py (encoding="utf-8")
extracting messages from invenio_accounts/config.py (encoding="utf-8")
extracting messages from invenio_accounts/datastore.py (encoding="utf-8")
extracting messages from invenio_accounts/domains.py (encoding="utf-8")
extracting messages from invenio_accounts/errors.py (encoding="utf-8")
extracting messages from invenio_accounts/ext.py (encoding="utf-8")
extracting messages from invenio_accounts/forms.py (encoding="utf-8")
extracting messages from invenio_accounts/hash.py (encoding="utf-8")
extracting messages from invenio_accounts/models.py (encoding="utf-8")
extracting messages from invenio_accounts/proxies.py (encoding="utf-8")
extracting messages from invenio_accounts/sessions.py (encoding="utf-8")
extracting messages from invenio_accounts/signals.py (encoding="utf-8")
extracting messages from invenio_accounts/tasks.py (encoding="utf-8")
extracting messages from invenio_accounts/testutils.py (encoding="utf-8")
extracting messages from invenio_accounts/utils.py (encoding="utf-8")
extracting messages from invenio_accounts/alembic/037afe10e9ff_add_user_moderation_fields.py (encoding="utf-8")
extracting messages from invenio_accounts/alembic/62efc52773d4_create_useridentity_table.py (encoding="utf-8")
extracting messages from invenio_accounts/alembic/6ec5ce377ca3_create_domains.py (encoding="utf-8")
extracting messages from invenio_accounts/alembic/843bc79c426f_create_accounts_branch.py (encoding="utf-8")
extracting messages from invenio_accounts/alembic/9848d0149abd_create_accounts_tables.py (encoding="utf-8")
extracting messages from invenio_accounts/alembic/999dcbd19ace_users_versioning.py (encoding="utf-8")
extracting messages from invenio_accounts/alembic/dfbdf43a3e96_separate_login_info.py (encoding="utf-8")
extracting messages from invenio_accounts/alembic/e12419831262_add_new_columns_on_sessionactivity.py (encoding="utf-8")
extracting messages from invenio_accounts/alembic/eb9743315a9d_add_userprofile.py (encoding="utf-8")
extracting messages from invenio_accounts/alembic/f2522cdd5fcd_change_accountsrole_primary_key_to_string.py (encoding="utf-8")
extracting messages from invenio_accounts/context_processors/__init__.py (encoding="utf-8")
extracting messages from invenio_accounts/context_processors/jwt.py (encoding="utf-8")
extracting messages from invenio_accounts/profiles/__init__.py (encoding="utf-8")
extracting messages from invenio_accounts/profiles/dicts.py (encoding="utf-8")
extracting messages from invenio_accounts/profiles/schemas.py (encoding="utf-8")
extracting messages from invenio_accounts/templates/invenio_accounts/_macros.html (encoding="utf-8")
extracting messages from invenio_accounts/templates/invenio_accounts/base.html (encoding="utf-8")
extracting messages from invenio_accounts/templates/invenio_accounts/base_cover.html (encoding="utf-8")
extracting messages from invenio_accounts/templates/invenio_accounts/change_password.html (encoding="utf-8")
extracting messages from invenio_accounts/templates/invenio_accounts/forgot_password.html (encoding="utf-8")
extracting messages from invenio_accounts/templates/invenio_accounts/jwt.html (encoding="utf-8")
extracting messages from invenio_accounts/templates/invenio_accounts/login_user.html (encoding="utf-8")
extracting messages from invenio_accounts/templates/invenio_accounts/register_user.html (encoding="utf-8")
extracting messages from invenio_accounts/templates/invenio_accounts/reset_password.html (encoding="utf-8")
extracting messages from invenio_accounts/templates/invenio_accounts/send_confirmation.html (encoding="utf-8")
extracting messages from invenio_accounts/templates/invenio_accounts/send_login.html (encoding="utf-8")
extracting messages from invenio_accounts/templates/invenio_accounts/settings/base.html (encoding="utf-8")
extracting messages from invenio_accounts/templates/invenio_accounts/settings/security.html (encoding="utf-8")
extracting messages from invenio_accounts/templates/security/email/change_notice_rest.html (encoding="utf-8")
extracting messages from invenio_accounts/templates/semantic-ui/invenio_accounts/_macros.html (encoding="utf-8")
extracting messages from invenio_accounts/templates/semantic-ui/invenio_accounts/base.html (encoding="utf-8")
extracting messages from invenio_accounts/templates/semantic-ui/invenio_accounts/base_cover.html (encoding="utf-8")
extracting messages from invenio_accounts/templates/semantic-ui/invenio_accounts/change_password.html (encoding="utf-8")
extracting messages from invenio_accounts/templates/semantic-ui/invenio_accounts/forgot_password.html (encoding="utf-8")
extracting messages from invenio_accounts/templates/semantic-ui/invenio_accounts/jwt.html (encoding="utf-8")
extracting messages from invenio_accounts/templates/semantic-ui/invenio_accounts/login_user.html (encoding="utf-8")
extracting messages from invenio_accounts/templates/semantic-ui/invenio_accounts/register_user.html (encoding="utf-8")
extracting messages from invenio_accounts/templates/semantic-ui/invenio_accounts/reset_password.html (encoding="utf-8")
extracting messages from invenio_accounts/templates/semantic-ui/invenio_accounts/send_confirmation.html (encoding="utf-8")
extracting messages from invenio_accounts/templates/semantic-ui/invenio_accounts/send_login.html (encoding="utf-8")
extracting messages from invenio_accounts/templates/semantic-ui/invenio_accounts/settings/base.html (encoding="utf-8")
extracting messages from invenio_accounts/templates/semantic-ui/invenio_accounts/settings/security.html (encoding="utf-8")
extracting messages from invenio_accounts/views/__init__.py (encoding="utf-8")
extracting messages from invenio_accounts/views/rest.py (encoding="utf-8")
extracting messages from invenio_accounts/views/security.py (encoding="utf-8")
extracting messages from invenio_accounts/views/settings.py (encoding="utf-8")
writing PO template file to /dev/null
 redis Pulling 
 postgresql Pulling 
 8e44f01296e3 Pulling fs layer 
 44fc29a25beb Pulling fs layer 
 39af693970c0 Pulling fs layer 
 517b08eaf3cc Pulling fs layer 
 186a03b51bfa Pulling fs layer 
 fe77c85f37cb Pulling fs layer 
 4f4fb700ef54 Pulling fs layer 
 a43f12641297 Pulling fs layer 
 186a03b51bfa Waiting 
 fe77c85f37cb Waiting 
 4f4fb700ef54 Waiting 
 a43f12641297 Waiting 
 517b08eaf3cc Waiting 
 b0a0cf830b12 Pulling fs layer 
 dda3d8fbd5ed Pulling fs layer 
 283a477db7bb Pulling fs layer 
 91d2729fa4d5 Pulling fs layer 
 9739ced65621 Pulling fs layer 
 ae3bb1b347a4 Pulling fs layer 
 f8406d9c00ea Pulling fs layer 
 b0a0cf830b12 Waiting 
 c199bff16b05 Pulling fs layer 
 e0d55fdb4d15 Pulling fs layer 
 dda3d8fbd5ed Waiting 
 c1cb13b19080 Pulling fs layer 
 873532e5f8c7 Pulling fs layer 
 050d9f8c3b1c Pulling fs layer 
 283a477db7bb Waiting 
 710e142705f8 Pulling fs layer 
 cb628c265f09 Pulling fs layer 
 91d2729fa4d5 Waiting 
 9739ced65621 Waiting 
 c1cb13b19080 Waiting 
 ae3bb1b347a4 Waiting 
 873532e5f8c7 Waiting 
 f8406d9c00ea Waiting 
 050d9f8c3b1c Waiting 
 c199bff16b05 Waiting 
 710e142705f8 Waiting 
 e0d55fdb4d15 Waiting 
 cb628c265f09 Waiting 
 44fc29a25beb Downloading [==========================================>        ]     935B/1.105kB
 44fc29a25beb Downloading [==================================================>]  1.105kB/1.105kB
 44fc29a25beb Verifying Checksum 
 44fc29a25beb Download complete 
 39af693970c0 Downloading [==================================================>]     874B/874B
 39af693970c0 Download complete 
 8e44f01296e3 Downloading [>                                                  ]  286.7kB/28.23MB
 517b08eaf3cc Downloading [>                                                  ]  14.62kB/1.438MB
 8e44f01296e3 Downloading [==========>                                        ]  6.076MB/28.23MB
 517b08eaf3cc Verifying Checksum 
 517b08eaf3cc Download complete 
 186a03b51bfa Downloading [>                                                  ]  155.6kB/15.35MB
 186a03b51bfa Verifying Checksum 
 186a03b51bfa Download complete 
 8e44f01296e3 Downloading [=================================>                 ]  19.09MB/28.23MB
 fe77c85f37cb Downloading [==================================================>]      97B/97B
 fe77c85f37cb Verifying Checksum 
 fe77c85f37cb Download complete 
 8e44f01296e3 Downloading [=======================================>           ]  22.28MB/28.23MB
 4f4fb700ef54 Downloading [==================================================>]      32B/32B
 4f4fb700ef54 Verifying Checksum 
 4f4fb700ef54 Download complete 
 a43f12641297 Downloading [==================================================>]     571B/571B
 a43f12641297 Verifying Checksum 
 a43f12641297 Download complete 
 8e44f01296e3 Downloading [============================================>      ]  25.16MB/28.23MB
 8e44f01296e3 Verifying Checksum 
 8e44f01296e3 Download complete 
 b0a0cf830b12 Downloading [>                                                  ]  298.7kB/29.15MB
 dda3d8fbd5ed Downloading [========================================>          ]     936B/1.165kB
 dda3d8fbd5ed Downloading [==================================================>]  1.165kB/1.165kB
 dda3d8fbd5ed Verifying Checksum 
 dda3d8fbd5ed Download complete 
 8e44f01296e3 Extracting [>                                                  ]  294.9kB/28.23MB
 283a477db7bb Downloading [>                                                  ]  46.47kB/4.533MB
 91d2729fa4d5 Downloading [>                                                  ]  14.62kB/1.45MB
 8e44f01296e3 Extracting [==========>                                        ]  6.193MB/28.23MB
 b0a0cf830b12 Downloading [========================>                          ]  14.04MB/29.15MB
 283a477db7bb Verifying Checksum 
 283a477db7bb Download complete 
 91d2729fa4d5 Verifying Checksum 
 91d2729fa4d5 Download complete 
 8e44f01296e3 Extracting [================>                                  ]  9.437MB/28.23MB
 b0a0cf830b12 Downloading [========================================>          ]  23.62MB/29.15MB
 9739ced65621 Downloading [>                                                  ]  81.06kB/8.069MB
 b0a0cf830b12 Verifying Checksum 
 b0a0cf830b12 Download complete 
 ae3bb1b347a4 Downloading [>                                                  ]  13.25kB/1.196MB
 9739ced65621 Verifying Checksum 
 9739ced65621 Download complete 
 ae3bb1b347a4 Verifying Checksum 
 ae3bb1b347a4 Download complete 
 b0a0cf830b12 Extracting [>                                                  ]  294.9kB/29.15MB
 8e44f01296e3 Extracting [=====================>                             ]  12.39MB/28.23MB
 c199bff16b05 Downloading [==============>                                    ]     934B/3.145kB
 c199bff16b05 Downloading [==================================================>]  3.145kB/3.145kB
 c199bff16b05 Verifying Checksum 
 c199bff16b05 Download complete 
 b0a0cf830b12 Extracting [=========>                                         ]  5.308MB/29.15MB
 8e44f01296e3 Extracting [==================================>                ]  19.46MB/28.23MB
 e0d55fdb4d15 Downloading [>                                                  ]  530.3kB/109MB
 b0a0cf830b12 Extracting [================>                                  ]  9.437MB/29.15MB
 e0d55fdb4d15 Downloading [============>                                      ]  27.22MB/109MB
 8e44f01296e3 Extracting [=========================================>         ]   23.3MB/28.23MB
 c1cb13b19080 Downloading [====>                                              ]     933B/9.925kB
 c1cb13b19080 Downloading [==================================================>]  9.925kB/9.925kB
 c1cb13b19080 Verifying Checksum 
 c1cb13b19080 Download complete 
 f8406d9c00ea Downloading [==================================================>]     116B/116B
 f8406d9c00ea Verifying Checksum 
 f8406d9c00ea Download complete 
 b0a0cf830b12 Extracting [==================>                                ]  10.91MB/29.15MB
 e0d55fdb4d15 Downloading [======================>                            ]  49.07MB/109MB
 8e44f01296e3 Extracting [==========================================>        ]  23.89MB/28.23MB
 873532e5f8c7 Downloading [==================================================>]     128B/128B
 873532e5f8c7 Verifying Checksum 
 873532e5f8c7 Download complete 
 b0a0cf830b12 Extracting [===========================>                       ]  16.22MB/29.15MB
 e0d55fdb4d15 Downloading [===========================>                       ]  59.19MB/109MB
 050d9f8c3b1c Downloading [==================================================>]     169B/169B
 050d9f8c3b1c Verifying Checksum 
 050d9f8c3b1c Download complete 
 710e142705f8 Downloading [========>                                          ]     933B/5.421kB
 710e142705f8 Downloading [==================================================>]  5.421kB/5.421kB
 710e142705f8 Verifying Checksum 
 710e142705f8 Download complete 
 e0d55fdb4d15 Downloading [==================================>                ]  74.68MB/109MB
 b0a0cf830b12 Extracting [======================================>            ]  22.71MB/29.15MB
 8e44f01296e3 Extracting [===============================================>   ]  26.84MB/28.23MB
 cb628c265f09 Downloading [==================================================>]     184B/184B
 cb628c265f09 Verifying Checksum 
 cb628c265f09 Download complete 
 e0d55fdb4d15 Downloading [=========================================>         ]  89.61MB/109MB
 e0d55fdb4d15 Downloading [==============================================>    ]  101.9MB/109MB
 b0a0cf830b12 Extracting [==========================================>        ]  24.77MB/29.15MB
 e0d55fdb4d15 Verifying Checksum 
 e0d55fdb4d15 Download complete 
 b0a0cf830b12 Extracting [===============================================>   ]  27.72MB/29.15MB
 8e44f01296e3 Extracting [================================================>  ]  27.43MB/28.23MB
 8e44f01296e3 Extracting [==================================================>]  28.23MB/28.23MB
 8e44f01296e3 Pull complete 
 44fc29a25beb Extracting [==================================================>]  1.105kB/1.105kB
 44fc29a25beb Extracting [==================================================>]  1.105kB/1.105kB
 b0a0cf830b12 Extracting [================================================>  ]  28.31MB/29.15MB
 b0a0cf830b12 Extracting [==================================================>]  29.15MB/29.15MB
 b0a0cf830b12 Pull complete 
 dda3d8fbd5ed Extracting [==================================================>]  1.165kB/1.165kB
 dda3d8fbd5ed Extracting [==================================================>]  1.165kB/1.165kB
 dda3d8fbd5ed Pull complete 
 44fc29a25beb Pull complete 
 283a477db7bb Extracting [>                                                  ]  65.54kB/4.533MB
 39af693970c0 Extracting [==================================================>]     874B/874B
 39af693970c0 Extracting [==================================================>]     874B/874B
 39af693970c0 Pull complete 
 517b08eaf3cc Extracting [=>                                                 ]  32.77kB/1.438MB
 517b08eaf3cc Extracting [==================================================>]  1.438MB/1.438MB
 517b08eaf3cc Extracting [==================================================>]  1.438MB/1.438MB
 517b08eaf3cc Pull complete 
 186a03b51bfa Extracting [>                                                  ]  163.8kB/15.35MB
 283a477db7bb Extracting [=================================================> ]  4.522MB/4.533MB
 283a477db7bb Extracting [==================================================>]  4.533MB/4.533MB
 186a03b51bfa Extracting [========================>                          ]  7.537MB/15.35MB
 283a477db7bb Pull complete 
 91d2729fa4d5 Extracting [=>                                                 ]  32.77kB/1.45MB
 91d2729fa4d5 Extracting [==================================================>]   1.45MB/1.45MB
 91d2729fa4d5 Pull complete 
 9739ced65621 Extracting [>                                                  ]   98.3kB/8.069MB
 186a03b51bfa Extracting [================================================>  ]  14.91MB/15.35MB
 186a03b51bfa Extracting [==================================================>]  15.35MB/15.35MB
 186a03b51bfa Pull complete 
 fe77c85f37cb Extracting [==================================================>]      97B/97B
 fe77c85f37cb Extracting [==================================================>]      97B/97B
 fe77c85f37cb Pull complete 
 4f4fb700ef54 Extracting [==================================================>]      32B/32B
 4f4fb700ef54 Extracting [==================================================>]      32B/32B
 4f4fb700ef54 Pull complete 
 a43f12641297 Extracting [==================================================>]     571B/571B
 a43f12641297 Extracting [==================================================>]     571B/571B
 9739ced65621 Extracting [====================>                              ]  3.342MB/8.069MB
 a43f12641297 Pull complete 
 redis Pulled 
 9739ced65621 Extracting [====================================>              ]  5.898MB/8.069MB
 9739ced65621 Extracting [==================================================>]  8.069MB/8.069MB
 9739ced65621 Pull complete 
 ae3bb1b347a4 Extracting [=>                                                 ]  32.77kB/1.196MB
 ae3bb1b347a4 Extracting [==================================================>]  1.196MB/1.196MB
 ae3bb1b347a4 Extracting [==================================================>]  1.196MB/1.196MB
 ae3bb1b347a4 Pull complete 
 f8406d9c00ea Extracting [==================================================>]     116B/116B
 f8406d9c00ea Extracting [==================================================>]     116B/116B
 f8406d9c00ea Pull complete 
 c199bff16b05 Extracting [==================================================>]  3.145kB/3.145kB
 c199bff16b05 Extracting [==================================================>]  3.145kB/3.145kB
 c199bff16b05 Pull complete 
 e0d55fdb4d15 Extracting [>                                                  ]  557.1kB/109MB
 e0d55fdb4d15 Extracting [===>                                               ]  7.242MB/109MB
 e0d55fdb4d15 Extracting [====>                                              ]  10.58MB/109MB
 e0d55fdb4d15 Extracting [=======>                                           ]  16.15MB/109MB
 e0d55fdb4d15 Extracting [=========>                                         ]  21.73MB/109MB
 e0d55fdb4d15 Extracting [============>                                      ]  26.74MB/109MB
 e0d55fdb4d15 Extracting [================>                                  ]  36.21MB/109MB
 e0d55fdb4d15 Extracting [====================>                              ]  45.68MB/109MB
 e0d55fdb4d15 Extracting [========================>                          ]  52.36MB/109MB
 e0d55fdb4d15 Extracting [==========================>                        ]  58.49MB/109MB
 e0d55fdb4d15 Extracting [==============================>                    ]  66.85MB/109MB
 e0d55fdb4d15 Extracting [===================================>               ]  76.87MB/109MB
 e0d55fdb4d15 Extracting [=======================================>           ]  85.79MB/109MB
 e0d55fdb4d15 Extracting [==========================================>        ]  92.47MB/109MB
 e0d55fdb4d15 Extracting [============================================>      ]  96.37MB/109MB
 e0d55fdb4d15 Extracting [=============================================>     ]   98.6MB/109MB
 e0d55fdb4d15 Extracting [==============================================>    ]  101.9MB/109MB
 e0d55fdb4d15 Extracting [===============================================>   ]  104.2MB/109MB
 e0d55fdb4d15 Extracting [================================================>  ]  105.8MB/109MB
 e0d55fdb4d15 Extracting [=================================================> ]  107.5MB/109MB
 e0d55fdb4d15 Extracting [==================================================>]    109MB/109MB
 e0d55fdb4d15 Pull complete 
 c1cb13b19080 Extracting [==================================================>]  9.925kB/9.925kB
 c1cb13b19080 Extracting [==================================================>]  9.925kB/9.925kB
 c1cb13b19080 Pull complete 
 873532e5f8c7 Extracting [==================================================>]     128B/128B
 873532e5f8c7 Extracting [==================================================>]     128B/128B
 873532e5f8c7 Pull complete 
 050d9f8c3b1c Extracting [==================================================>]     169B/169B
 050d9f8c3b1c Extracting [==================================================>]     169B/169B
 050d9f8c3b1c Pull complete 
 710e142705f8 Extracting [==================================================>]  5.421kB/5.421kB
 710e142705f8 Extracting [==================================================>]  5.421kB/5.421kB
 710e142705f8 Pull complete 
 cb628c265f09 Extracting [==================================================>]     184B/184B
 cb628c265f09 Extracting [==================================================>]     184B/184B
 cb628c265f09 Pull complete 
 postgresql Pulled 
 Network docker_services_cli_default  Creating
 Network docker_services_cli_default  Created
 Container docker_services_cli-redis-1  Creating
 Container docker_services_cli-postgresql-1  Creating
 Container docker_services_cli-redis-1  Created
 Container docker_services_cli-postgresql-1  Created
 Container docker_services_cli-redis-1  Starting
 Container docker_services_cli-postgresql-1  Starting
 Container docker_services_cli-redis-1  Started
 Container docker_services_cli-postgresql-1  Started
::warning file=/home/runner/work/invenio-bug-verification/invenio-bug-verification/package-repo/.venv/lib/python3.12/site-packages/passlib/utils/__init__.py,line=854::'crypt' is deprecated and slated for removal in Python 3.13
::warning file=/home/runner/work/invenio-bug-verification/invenio-bug-verification/package-repo/.venv/lib/python3.12/site-packages/webargs/compat.py,line=8::The '__version__' attribute is deprecated and will be removed in in a future version. Use feature detection or 'importlib.metadata.version("marshmallow")' instead.
::warning file=/home/runner/work/invenio-bug-verification/invenio-bug-verification/package-repo/.venv/lib/python3.12/site-packages/webargs/compat.py,line=8::distutils Version classes are deprecated. Use packaging.version instead.
::warning file=/home/runner/work/invenio-bug-verification/invenio-bug-verification/package-repo/.venv/lib/python3.12/site-packages/webargs/__init__.py,line=13::distutils Version classes are deprecated. Use packaging.version instead.
::warning file=/home/runner/work/invenio-bug-verification/invenio-bug-verification/package-repo/.venv/lib/python3.12/site-packages/passlib/pwd.py,line=16::pkg_resources is deprecated as an API. See https://setuptools.pypa.io/en/latest/pkg_resources.html. The pkg_resources package is slated for removal as early as 2025-11-30. Refrain from using this package or pin to Setuptools<81.
::warning file=/home/runner/work/invenio-bug-verification/invenio-bug-verification/package-repo/.venv/lib/python3.12/site-packages/pkg_resources/__init__.py,line=3146::Deprecated call to `pkg_resources.declare_namespace('sphinxcontrib')`.%0AImplementing implicit namespace packages (as specified in PEP 420) is preferred to `pkg_resources.declare_namespace`. See https://setuptools.pypa.io/en/latest/references/keywords.html#keyword-namespace-packages
============================= test session starts ==============================
platform linux -- Python 3.12.12, pytest-8.4.2, pluggy-1.6.0
rootdir: /home/runner/work/invenio-bug-verification/invenio-bug-verification/package-repo
configfile: setup.cfg
testpaths: tests, invenio_accounts
plugins: github-actions-annotate-failures-0.3.0, pycodestyle-2.5.0, flask-1.3.0, black-ng-0.4.1, invenio-3.4.2, isort-4.0.0, cov-7.0.0, pydocstyle-2.4.0
collected 247 items / 1 skipped

tests/conftest.py ...                                                    [  1%]
tests/e2e/conftest.py ...                                                [  2%]
tests/e2e/e2e_basic_test.py ...                                          [  3%]
tests/test_admin.py ...::warning file=/home/runner/work/invenio-bug-verification/invenio-bug-verification/package-repo/.venv/lib/python3.12/site-packages/flask_security/datastore.py,line=207::get_user method is deprecated, user get_user_by_email/get_user_by_id
::warning file=/home/runner/work/invenio-bug-verification/invenio-bug-verification/package-repo/.venv/lib/python3.12/site-packages/flask_security/datastore.py,line=207::get_user method is deprecated, user get_user_by_email/get_user_by_id
::warning file=/home/runner/work/invenio-bug-verification/invenio-bug-verification/package-repo/.venv/lib/python3.12/site-packages/flask_security/datastore.py,line=207::get_user method is deprecated, user get_user_by_email/get_user_by_id
::warning file=/home/runner/work/invenio-bug-verification/invenio-bug-verification/package-repo/.venv/lib/python3.12/site-packages/flask_security/datastore.py,line=207::get_user method is deprecated, user get_user_by_email/get_user_by_id
::warning file=/home/runner/work/invenio-bug-verification/invenio-bug-verification/package-repo/.venv/lib/python3.12/site-packages/flask_security/datastore.py,line=207::get_user method is deprecated, user get_user_by_email/get_user_by_id
.::warning file=/home/runner/work/invenio-bug-verification/invenio-bug-verification/package-repo/.venv/lib/python3.12/site-packages/flask_security/datastore.py,line=207::get_user method is deprecated, user get_user_by_email/get_user_by_id
::warning file=/home/runner/work/invenio-bug-verification/invenio-bug-verification/package-repo/.venv/lib/python3.12/site-packages/flask_security/datastore.py,line=207::get_user method is deprecated, user get_user_by_email/get_user_by_id
::warning file=/home/runner/work/invenio-bug-verification/invenio-bug-verification/package-repo/.venv/lib/python3.12/site-packages/flask_security/datastore.py,line=207::get_user method is deprecated, user get_user_by_email/get_user_by_id
::warning file=/home/runner/work/invenio-bug-verification/invenio-bug-verification/package-repo/.venv/lib/python3.12/site-packages/flask_security/datastore.py,line=207::get_user method is deprecated, user get_user_by_email/get_user_by_id
::warning file=/home/runner/work/invenio-bug-verification/invenio-bug-verification/package-repo/.venv/lib/python3.12/site-packages/flask_security/datastore.py,line=207::get_user method is deprecated, user get_user_by_email/get_user_by_id
::warning file=/home/runner/work/invenio-bug-verification/invenio-bug-verification/package-repo/.venv/lib/python3.12/site-packages/flask_security/datastore.py,line=207::get_user method is deprecated, user get_user_by_email/get_user_by_id
.                                                [  5%]
tests/test_cli.py ......::warning file=/home/runner/work/invenio-bug-verification/invenio-bug-verification/package-repo/.venv/lib/python3.12/site-packages/flask_security/datastore.py,line=207::get_user method is deprecated, user get_user_by_email/get_user_by_id
::warning file=/home/runner/work/invenio-bug-verification/invenio-bug-verification/package-repo/.venv/lib/python3.12/site-packages/flask_security/datastore.py,line=207::get_user method is deprecated, user get_user_by_email/get_user_by_id
::warning file=/home/runner/work/invenio-bug-verification/invenio-bug-verification/package-repo/.venv/lib/python3.12/site-packages/flask_security/datastore.py,line=207::get_user method is deprecated, user get_user_by_email/get_user_by_id
::warning file=/home/runner/work/invenio-bug-verification/invenio-bug-verification/package-repo/.venv/lib/python3.12/site-packages/flask_security/datastore.py,line=207::get_user method is deprecated, user get_user_by_email/get_user_by_id
::warning file=/home/runner/work/invenio-bug-verification/invenio-bug-verification/package-repo/.venv/lib/python3.12/site-packages/flask_security/datastore.py,line=207::get_user method is deprecated, user get_user_by_email/get_user_by_id
::warning file=/home/runner/work/invenio-bug-verification/invenio-bug-verification/package-repo/.venv/lib/python3.12/site-packages/flask_security/datastore.py,line=207::get_user method is deprecated, user get_user_by_email/get_user_by_id
                                                 [  8%]
tests/test_forms.py ....                                                 [  9%]
tests/test_hash.py .......::warning file=/home/runner/work/invenio-bug-verification/invenio-bug-verification/package-repo/tests/test_hash.py,line=150::the method passlib.context.CryptContext.encrypt() is deprecated as of Passlib 1.7, and will be removed in Passlib 2.0, use CryptContext.hash() instead.
::warning file=/home/runner/work/invenio-bug-verification/invenio-bug-verification/package-repo/.venv/lib/python3.12/site-packages/passlib/context.py,line=2251::CryptContext.hash(): 'scheme' keyword is deprecated as of Passlib 1.7, and will be removed in Passlib 2.0
::warning file=/home/runner/work/invenio-bug-verification/invenio-bug-verification/package-repo/.venv/lib/python3.12/site-packages/passlib/context.py,line=2270::passing settings to invenio_aes_encrypted_email.hash() is deprecated, and won't be supported in Passlib 2.0; use 'invenio_aes_encrypted_email.using(**settings).hash(secret)' instead
.::warning file=/home/runner/work/invenio-bug-verification/invenio-bug-verification/package-repo/tests/test_hash.py,line=150::the method passlib.context.CryptContext.encrypt() is deprecated as of Passlib 1.7, and will be removed in Passlib 2.0, use CryptContext.hash() instead.
::warning file=/home/runner/work/invenio-bug-verification/invenio-bug-verification/package-repo/.venv/lib/python3.12/site-packages/passlib/context.py,line=2251::CryptContext.hash(): 'scheme' keyword is deprecated as of Passlib 1.7, and will be removed in Passlib 2.0
::warning file=/home/runner/work/invenio-bug-verification/invenio-bug-verification/package-repo/.venv/lib/python3.12/site-packages/passlib/context.py,line=2270::passing settings to invenio_aes_encrypted_email.hash() is deprecated, and won't be supported in Passlib 2.0; use 'invenio_aes_encrypted_email.using(**settings).hash(secret)' instead
..::warning file=/home/runner/work/invenio-bug-verification/invenio-bug-verification/package-repo/tests/test_hash.py,line=150::the method passlib.context.CryptContext.encrypt() is deprecated as of Passlib 1.7, and will be removed in Passlib 2.0, use CryptContext.hash() instead.
::warning file=/home/runner/work/invenio-bug-verification/invenio-bug-verification/package-repo/.venv/lib/python3.12/site-packages/passlib/context.py,line=2251::CryptContext.hash(): 'scheme' keyword is deprecated as of Passlib 1.7, and will be removed in Passlib 2.0
::warning file=/home/runner/work/invenio-bug-verification/invenio-bug-verification/package-repo/.venv/lib/python3.12/site-packages/passlib/context.py,line=2270::passing settings to invenio_aes_encrypted_email.hash() is deprecated, and won't be supported in Passlib 2.0; use 'invenio_aes_encrypted_email.using(**settings).hash(secret)' instead
..::warning file=/home/runner/work/invenio-bug-verification/invenio-bug-verification/package-repo/tests/test_hash.py,line=150::the method passlib.context.CryptContext.encrypt() is deprecated as of Passlib 1.7, and will be removed in Passlib 2.0, use CryptContext.hash() instead.
::warning file=/home/runner/work/invenio-bug-verification/invenio-bug-verification/package-repo/.venv/lib/python3.12/site-packages/passlib/context.py,line=2251::CryptContext.hash(): 'scheme' keyword is deprecated as of Passlib 1.7, and will be removed in Passlib 2.0
::warning file=/home/runner/work/invenio-bug-verification/invenio-bug-verification/package-repo/.venv/lib/python3.12/site-packages/passlib/context.py,line=2270::passing settings to invenio_aes_encrypted_email.hash() is deprecated, and won't be supported in Passlib 2.0; use 'invenio_aes_encrypted_email.using(**settings).hash(secret)' instead
                                          [ 14%]
tests/test_invenio_accounts.py ......s....::warning file=/home/runner/work/invenio-bug-verification/invenio-bug-verification/package-repo/.venv/lib/python3.12/site-packages/flask_security/datastore.py,line=207::get_user method is deprecated, user get_user_by_email/get_user_by_id
.....E.                        [ 21%]
tests/test_models.py ..........                                          [ 25%]
tests/test_schemas.py .....                                              [ 27%]
tests/test_sessions.py .....ss.....                                      [ 32%]
tests/test_tasks.py ......                                               [ 34%]
tests/test_template_context_processors.py ....                           [ 36%]
tests/test_token_duration.py .....                                       [ 38%]
tests/test_utils.py ..........                                           [ 42%]
tests/test_validated_dicts.py .....                                      [ 44%]
tests/test_views.py ........                                             [ 47%]
tests/test_views_rest.py ...::warning file=/home/runner/work/invenio-bug-verification/invenio-bug-verification/package-repo/.venv/lib/python3.12/site-packages/flask_security/datastore.py,line=207::get_user method is deprecated, user get_user_by_email/get_user_by_id
::warning file=/home/runner/work/invenio-bug-verification/invenio-bug-verification/package-repo/.venv/lib/python3.12/site-packages/flask_security/datastore.py,line=207::get_user method is deprecated, user get_user_by_email/get_user_by_id
::warning file=/home/runner/work/invenio-bug-verification/invenio-bug-verification/package-repo/.venv/lib/python3.12/site-packages/flask_security/datastore.py,line=207::get_user method is deprecated, user get_user_by_email/get_user_by_id
::warning file=/home/runner/work/invenio-bug-verification/invenio-bug-verification/package-repo/.venv/lib/python3.12/site-packages/flask_security/datastore.py,line=207::get_user method is deprecated, user get_user_by_email/get_user_by_id
::warning file=/home/runner/work/invenio-bug-verification/invenio-bug-verification/package-repo/.venv/lib/python3.12/site-packages/flask_security/datastore.py,line=207::get_user method is deprecated, user get_user_by_email/get_user_by_id
::warning file=/home/runner/work/invenio-bug-verification/invenio-bug-verification/package-repo/.venv/lib/python3.12/site-packages/flask_security/datastore.py,line=207::get_user method is deprecated, user get_user_by_email/get_user_by_id
::warning file=/home/runner/work/invenio-bug-verification/invenio-bug-verification/package-repo/.venv/lib/python3.12/site-packages/flask_security/datastore.py,line=207::get_user method is deprecated, user get_user_by_email/get_user_by_id
::warning file=/home/runner/work/invenio-bug-verification/invenio-bug-verification/package-repo/.venv/lib/python3.12/site-packages/flask_security/datastore.py,line=207::get_user method is deprecated, user get_user_by_email/get_user_by_id
.::warning file=/home/runner/work/invenio-bug-verification/invenio-bug-verification/package-repo/.venv/lib/python3.12/site-packages/flask_security/datastore.py,line=207::get_user method is deprecated, user get_user_by_email/get_user_by_id
.::warning file=/home/runner/work/invenio-bug-verification/invenio-bug-verification/package-repo/.venv/lib/python3.12/site-packages/flask_security/datastore.py,line=207::get_user method is deprecated, user get_user_by_email/get_user_by_id
::warning file=/home/runner/work/invenio-bug-verification/invenio-bug-verification/package-repo/.venv/lib/python3.12/site-packages/flask_security/datastore.py,line=207::get_user method is deprecated, user get_user_by_email/get_user_by_id
::warning file=/home/runner/work/invenio-bug-verification/invenio-bug-verification/package-repo/.venv/lib/python3.12/site-packages/flask_security/datastore.py,line=207::get_user method is deprecated, user get_user_by_email/get_user_by_id
.::warning file=/home/runner/work/invenio-bug-verification/invenio-bug-verification/package-repo/.venv/lib/python3.12/site-packages/flask_security/datastore.py,line=207::get_user method is deprecated, user get_user_by_email/get_user_by_id
::warning file=/home/runner/work/invenio-bug-verification/invenio-bug-verification/package-repo/.venv/lib/python3.12/site-packages/flask_security/datastore.py,line=207::get_user method is deprecated, user get_user_by_email/get_user_by_id
::warning file=/home/runner/work/invenio-bug-verification/invenio-bug-verification/package-repo/.venv/lib/python3.12/site-packages/flask_security/datastore.py,line=207::get_user method is deprecated, user get_user_by_email/get_user_by_id
.::warning file=/home/runner/work/invenio-bug-verification/invenio-bug-verification/package-repo/.venv/lib/python3.12/site-packages/flask_security/datastore.py,line=207::get_user method is deprecated, user get_user_by_email/get_user_by_id
.::warning file=/home/runner/work/invenio-bug-verification/invenio-bug-verification/package-repo/.venv/lib/python3.12/site-packages/flask_security/datastore.py,line=207::get_user method is deprecated, user get_user_by_email/get_user_by_id
::warning file=/home/runner/work/invenio-bug-verification/invenio-bug-verification/package-repo/.venv/lib/python3.12/site-packages/flask_security/datastore.py,line=207::get_user method is deprecated, user get_user_by_email/get_user_by_id
.::warning file=/home/runner/work/invenio-bug-verification/invenio-bug-verification/package-repo/.venv/lib/python3.12/site-packages/flask_security/datastore.py,line=207::get_user method is deprecated, user get_user_by_email/get_user_by_id
::warning file=/home/runner/work/invenio-bug-verification/invenio-bug-verification/package-repo/.venv/lib/python3.12/site-packages/flask_security/datastore.py,line=207::get_user method is deprecated, user get_user_by_email/get_user_by_id
::warning file=/home/runner/work/invenio-bug-verification/invenio-bug-verification/package-repo/.venv/lib/python3.12/site-packages/flask_security/datastore.py,line=207::get_user method is deprecated, user get_user_by_email/get_user_by_id
.::warning file=/home/runner/work/invenio-bug-verification/invenio-bug-verification/package-repo/.venv/lib/python3.12/site-packages/flask_security/datastore.py,line=207::get_user method is deprecated, user get_user_by_email/get_user_by_id
...::warning file=/home/runner/work/invenio-bug-verification/invenio-bug-verification/package-repo/.venv/lib/python3.12/site-packages/flask_security/datastore.py,line=207::get_user method is deprecated, user get_user_by_email/get_user_by_id
::warning file=/home/runner/work/invenio-bug-verification/invenio-bug-verification/package-repo/.venv/lib/python3.12/site-packages/flask_security/datastore.py,line=207::get_user method is deprecated, user get_user_by_email/get_user_by_id
.::warning file=/home/runner/work/invenio-bug-verification/invenio-bug-verification/package-repo/.venv/lib/python3.12/site-packages/flask_security/datastore.py,line=207::get_user method is deprecated, user get_user_by_email/get_user_by_id
::warning file=/home/runner/work/invenio-bug-verification/invenio-bug-verification/package-repo/.venv/lib/python3.12/site-packages/flask_security/datastore.py,line=207::get_user method is deprecated, user get_user_by_email/get_user_by_id
.::warning file=/home/runner/work/invenio-bug-verification/invenio-bug-verification/package-repo/.venv/lib/python3.12/site-packages/flask_security/datastore.py,line=207::get_user method is deprecated, user get_user_by_email/get_user_by_id
::warning file=/home/runner/work/invenio-bug-verification/invenio-bug-verification/package-repo/.venv/lib/python3.12/site-packages/flask_security/datastore.py,line=207::get_user method is deprecated, user get_user_by_email/get_user_by_id
::warning file=/home/runner/work/invenio-bug-verification/invenio-bug-verification/package-repo/.venv/lib/python3.12/site-packages/flask_security/datastore.py,line=207::get_user method is deprecated, user get_user_by_email/get_user_by_id
::warning file=/home/runner/work/invenio-bug-verification/invenio-bug-verification/package-repo/.venv/lib/python3.12/site-packages/flask_security/datastore.py,line=207::get_user method is deprecated, user get_user_by_email/get_user_by_id
::warning file=/home/runner/work/invenio-bug-verification/invenio-bug-verification/package-repo/.venv/lib/python3.12/site-packages/flask_security/datastore.py,line=207::get_user method is deprecated, user get_user_by_email/get_user_by_id
::warning file=/home/runner/work/invenio-bug-verification/invenio-bug-verification/package-repo/.venv/lib/python3.12/site-packages/flask_security/datastore.py,line=207::get_user method is deprecated, user get_user_by_email/get_user_by_id
..::warning file=/home/runner/work/invenio-bug-verification/invenio-bug-verification/package-repo/.venv/lib/python3.12/site-packages/flask_security/datastore.py,line=207::get_user method is deprecated, user get_user_by_email/get_user_by_id
::warning file=/home/runner/work/invenio-bug-verification/invenio-bug-verification/package-repo/.venv/lib/python3.12/site-packages/flask_security/datastore.py,line=207::get_user method is deprecated, user get_user_by_email/get_user_by_id
::warning file=/home/runner/work/invenio-bug-verification/invenio-bug-verification/package-repo/.venv/lib/python3.12/site-packages/flask_security/datastore.py,line=207::get_user method is deprecated, user get_user_by_email/get_user_by_id
::warning file=/home/runner/work/invenio-bug-verification/invenio-bug-verification/package-repo/.venv/lib/python3.12/site-packages/flask_security/datastore.py,line=207::get_user method is deprecated, user get_user_by_email/get_user_by_id
::warning file=/home/runner/work/invenio-bug-verification/invenio-bug-verification/package-repo/.venv/lib/python3.12/site-packages/flask_security/datastore.py,line=207::get_user method is deprecated, user get_user_by_email/get_user_by_id
::warning file=/home/runner/work/invenio-bug-verification/invenio-bug-verification/package-repo/.venv/lib/python3.12/site-packages/flask_security/datastore.py,line=207::get_user method is deprecated, user get_user_by_email/get_user_by_id
.::warning file=/home/runner/work/invenio-bug-verification/invenio-bug-verification/package-repo/.venv/lib/python3.12/site-packages/flask_security/datastore.py,line=207::get_user method is deprecated, user get_user_by_email/get_user_by_id
::warning file=/home/runner/work/invenio-bug-verification/invenio-bug-verification/package-repo/.venv/lib/python3.12/site-packages/flask_security/datastore.py,line=207::get_user method is deprecated, user get_user_by_email/get_user_by_id
::warning file=/home/runner/work/invenio-bug-verification/invenio-bug-verification/package-repo/.venv/lib/python3.12/site-packages/flask_security/datastore.py,line=207::get_user method is deprecated, user get_user_by_email/get_user_by_id
::warning file=/home/runner/work/invenio-bug-verification/invenio-bug-verification/package-repo/.venv/lib/python3.12/site-packages/flask_security/datastore.py,line=207::get_user method is deprecated, user get_user_by_email/get_user_by_id
::warning file=/home/runner/work/invenio-bug-verification/invenio-bug-verification/package-repo/.venv/lib/python3.12/site-packages/flask_security/datastore.py,line=207::get_user method is deprecated, user get_user_by_email/get_user_by_id
::warning file=/home/runner/work/invenio-bug-verification/invenio-bug-verification/package-repo/.venv/lib/python3.12/site-packages/flask_security/datastore.py,line=207::get_user method is deprecated, user get_user_by_email/get_user_by_id
                              [ 55%]
invenio_accounts/__init__.py ...                                         [ 56%]
invenio_accounts/admin.py ...                                            [ 57%]
invenio_accounts/alembic/037afe10e9ff_add_user_moderation_fields.py ...  [ 58%]
invenio_accounts/alembic/62efc52773d4_create_useridentity_table.py ...   [ 59%]
invenio_accounts/alembic/6ec5ce377ca3_create_domains.py ...              [ 61%]
invenio_accounts/alembic/843bc79c426f_create_accounts_branch.py ...      [ 62%]
invenio_accounts/alembic/9848d0149abd_create_accounts_tables.py ...      [ 63%]
invenio_accounts/alembic/999dcbd19ace_users_versioning.py ...            [ 64%]
invenio_accounts/alembic/dfbdf43a3e96_separate_login_info.py ...         [ 65%]
invenio_accounts/alembic/e12419831262_add_new_columns_on_sessionactivity.py . [ 66%]
..                                                                       [ 67%]
invenio_accounts/alembic/eb9743315a9d_add_userprofile.py ...             [ 68%]
invenio_accounts/alembic/f2522cdd5fcd_change_accountsrole_primary_key_to_string.py . [ 68%]
..                                                                       [ 69%]
invenio_accounts/api.py ...                                              [ 70%]
invenio_accounts/cli.py ...                                              [ 72%]
invenio_accounts/config.py ...                                           [ 73%]
invenio_accounts/context_processors/__init__.py ...                      [ 74%]
invenio_accounts/context_processors/jwt.py ...                           [ 75%]
invenio_accounts/datastore.py ...                                        [ 76%]
invenio_accounts/domains.py ...                                          [ 78%]
invenio_accounts/errors.py ...                                           [ 79%]
invenio_accounts/ext.py ...                                              [ 80%]
invenio_accounts/forms.py ...                                            [ 81%]
invenio_accounts/hash.py ...                                             [ 82%]
invenio_accounts/models.py ...                                           [ 84%]
invenio_accounts/profiles/__init__.py ...                                [ 85%]
invenio_accounts/profiles/dicts.py ...                                   [ 86%]
invenio_accounts/profiles/schemas.py ...                                 [ 87%]
invenio_accounts/proxies.py ...                                          [ 89%]
invenio_accounts/sessions.py ...                                         [ 90%]
invenio_accounts/signals.py ...                                          [ 91%]
invenio_accounts/tasks.py ...                                            [ 92%]
invenio_accounts/testutils.py ...                                        [ 93%]
invenio_accounts/utils.py ...                                            [ 95%]
invenio_accounts/views/__init__.py ...                                   [ 96%]
invenio_accounts/views/rest.py ...                                       [ 97%]
invenio_accounts/views/security.py ...                                   [ 98%]
invenio_accounts/views/settings.py ...                                   [100%]

==================================== ERRORS ====================================
________ ERROR at teardown of test_kvsession_store_init_with_redis_url _________

self = <redis.connection.Connection(host=localhost,port=6380,db=0)>
check_health = True, retry_socket_connect = True

    def connect_check_health(
        self, check_health: bool = True, retry_socket_connect: bool = True
    ):
        if self._sock:
            return
        try:
            if retry_socket_connect:
>               sock = self.retry.call_with_retry(
                    lambda: self._connect(), lambda error: self.disconnect(error)
                )

.venv/lib/python3.12/site-packages/redis/connection.py:855: 
_ _ _ _ _ _ _ _ _ _ _ _ _ _ _ _ _ _ _ _ _ _ _ _ _ _ _ _ _ _ _ _ _ _ _ _ _ _ _ _ 
.venv/lib/python3.12/site-packages/redis/retry.py:116: in call_with_retry
    return do()
           ^^^^
.venv/lib/python3.12/site-packages/redis/connection.py:856: in <lambda>
    lambda: self._connect(), lambda error: self.disconnect(error)
            ^^^^^^^^^^^^^^^
.venv/lib/python3.12/site-packages/redis/connection.py:1306: in _connect
    raise err
_ _ _ _ _ _ _ _ _ _ _ _ _ _ _ _ _ _ _ _ _ _ _ _ _ _ _ _ _ _ _ _ _ _ _ _ _ _ _ _ 

self = <redis.connection.Connection(host=localhost,port=6380,db=0)>

    def _connect(self):
        "Create a TCP socket connection"
        # we want to mimic what socket.create_connection does to support
        # ipv4/ipv6, but we want to set options prior to calling
        # socket.connect()
        err = None
    
        for res in socket.getaddrinfo(
            self.host, self.port, self.socket_type, socket.SOCK_STREAM
        ):
            family, socktype, proto, canonname, socket_address = res
            sock = None
            try:
                sock = socket.socket(family, socktype, proto)
                # TCP_NODELAY
                sock.setsockopt(socket.IPPROTO_TCP, socket.TCP_NODELAY, 1)
    
                # TCP_KEEPALIVE
                if self.socket_keepalive:
                    sock.setsockopt(socket.SOL_SOCKET, socket.SO_KEEPALIVE, 1)
                    for k, v in self.socket_keepalive_options.items():
                        sock.setsockopt(socket.IPPROTO_TCP, k, v)
    
                # set the socket_connect_timeout before we connect
                sock.settimeout(self.socket_connect_timeout)
    
                # connect
>               sock.connect(socket_address)
E               ConnectionRefusedError: [Errno 111] Connection refused

.venv/lib/python3.12/site-packages/redis/connection.py:1290: ConnectionRefusedError

During handling of the above exception, another exception occurred:

    def teardown():
        with app.app_context():
            if database_exists(
                str(db.engine.url.render_as_string(hide_password=False))
            ):
                drop_database(str(db.engine.url.render_as_string(hide_password=False)))
            # Delete sessions in kvsession store
            if hasattr(app, "kvsession_store") and isinstance(
                app.kvsession_store, RedisStore
            ):
>               app.kvsession_store.redis.flushall()

tests/conftest.py:180: 
_ _ _ _ _ _ _ _ _ _ _ _ _ _ _ _ _ _ _ _ _ _ _ _ _ _ _ _ _ _ _ _ _ _ _ _ _ _ _ _ 
.venv/lib/python3.12/site-packages/redis/commands/core.py:934: in flushall
    return self.execute_command("FLUSHALL", *args, **kwargs)
           ^^^^^^^^^^^^^^^^^^^^^^^^^^^^^^^^^^^^^^^^^^^^^^^^^
.venv/lib/python3.12/site-packages/redis/client.py:657: in execute_command
    return self._execute_command(*args, **options)
           ^^^^^^^^^^^^^^^^^^^^^^^^^^^^^^^^^^^^^^^
.venv/lib/python3.12/site-packages/redis/client.py:663: in _execute_command
    conn = self.connection or pool.get_connection()
                              ^^^^^^^^^^^^^^^^^^^^^
.venv/lib/python3.12/site-packages/redis/utils.py:196: in wrapper
    return func(*args, **kwargs)
           ^^^^^^^^^^^^^^^^^^^^^
.venv/lib/python3.12/site-packages/redis/connection.py:2601: in get_connection
    connection.connect()
.venv/lib/python3.12/site-packages/redis/connection.py:846: in connect
    self.connect_check_health(check_health=True)
_ _ _ _ _ _ _ _ _ _ _ _ _ _ _ _ _ _ _ _ _ _ _ _ _ _ _ _ _ _ _ _ _ _ _ _ _ _ _ _ 

self = <redis.connection.Connection(host=localhost,port=6380,db=0)>
check_health = True, retry_socket_connect = True

    def connect_check_health(
        self, check_health: bool = True, retry_socket_connect: bool = True
    ):
        if self._sock:
            return
        try:
            if retry_socket_connect:
                sock = self.retry.call_with_retry(
                    lambda: self._connect(), lambda error: self.disconnect(error)
                )
            else:
                sock = self._connect()
        except socket.timeout:
            raise TimeoutError("Timeout connecting to server")
        except OSError as e:
>           raise ConnectionError(self._error_message(e))
E           redis.exceptions.ConnectionError: Error 111 connecting to localhost:6380. Connection refused.

.venv/lib/python3.12/site-packages/redis/connection.py:863: ConnectionError
=============================== warnings summary ===============================
.venv/lib/python3.12/site-packages/passlib/utils/__init__.py:854
  /home/runner/work/invenio-bug-verification/invenio-bug-verification/package-repo/.venv/lib/python3.12/site-packages/passlib/utils/__init__.py:854: DeprecationWarning: 'crypt' is deprecated and slated for removal in Python 3.13
    from crypt import crypt as _crypt

.venv/lib/python3.12/site-packages/webargs/compat.py:8
  /home/runner/work/invenio-bug-verification/invenio-bug-verification/package-repo/.venv/lib/python3.12/site-packages/webargs/compat.py:8: DeprecationWarning: The '__version__' attribute is deprecated and will be removed in in a future version. Use feature detection or 'importlib.metadata.version("marshmallow")' instead.
    MARSHMALLOW_VERSION_INFO = tuple(LooseVersion(ma.__version__).version)  # type: tuple

.venv/lib/python3.12/site-packages/webargs/compat.py:8
  /home/runner/work/invenio-bug-verification/invenio-bug-verification/package-repo/.venv/lib/python3.12/site-packages/webargs/compat.py:8: DeprecationWarning: distutils Version classes are deprecated. Use packaging.version instead.
    MARSHMALLOW_VERSION_INFO = tuple(LooseVersion(ma.__version__).version)  # type: tuple

.venv/lib/python3.12/site-packages/webargs/__init__.py:13
  /home/runner/work/invenio-bug-verification/invenio-bug-verification/package-repo/.venv/lib/python3.12/site-packages/webargs/__init__.py:13: DeprecationWarning: distutils Version classes are deprecated. Use packaging.version instead.
    __version_info__ = tuple(LooseVersion(__version__).version)

.venv/lib/python3.12/site-packages/passlib/pwd.py:16
  /home/runner/work/invenio-bug-verification/invenio-bug-verification/package-repo/.venv/lib/python3.12/site-packages/passlib/pwd.py:16: UserWarning: pkg_resources is deprecated as an API. See https://setuptools.pypa.io/en/latest/pkg_resources.html. The pkg_resources package is slated for removal as early as 2025-11-30. Refrain from using this package or pin to Setuptools<81.
    import pkg_resources

.venv/lib/python3.12/site-packages/pkg_resources/__init__.py:3146
  /home/runner/work/invenio-bug-verification/invenio-bug-verification/package-repo/.venv/lib/python3.12/site-packages/pkg_resources/__init__.py:3146: DeprecationWarning: Deprecated call to `pkg_resources.declare_namespace('sphinxcontrib')`.
  Implementing implicit namespace packages (as specified in PEP 420) is preferred to `pkg_resources.declare_namespace`. See https://setuptools.pypa.io/en/latest/references/keywords.html#keyword-namespace-packages
    declare_namespace(pkg)

tests/test_admin.py: 11 warnings
tests/test_cli.py: 6 warnings
tests/test_invenio_accounts.py: 1 warning
tests/test_views_rest.py: 44 warnings
  /home/runner/work/invenio-bug-verification/invenio-bug-verification/package-repo/.venv/lib/python3.12/site-packages/flask_security/datastore.py:207: DeprecationWarning: get_user method is deprecated, user get_user_by_email/get_user_by_id
    warnings.warn(

tests/test_hash.py::test_unicode_regression
tests/test_hash.py::test_invenio_aes_encrypted_email
tests/test_hash.py::test_legacy_user_login
tests/test_hash.py::test_monkey_patch_legacy
  /home/runner/work/invenio-bug-verification/invenio-bug-verification/package-repo/tests/test_hash.py:150: DeprecationWarning: the method passlib.context.CryptContext.encrypt() is deprecated as of Passlib 1.7, and will be removed in Passlib 2.0, use CryptContext.hash() instead.
    encrypted_password = ctx.encrypt(

tests/test_hash.py::test_unicode_regression
tests/test_hash.py::test_invenio_aes_encrypted_email
tests/test_hash.py::test_legacy_user_login
tests/test_hash.py::test_monkey_patch_legacy
  /home/runner/work/invenio-bug-verification/invenio-bug-verification/package-repo/.venv/lib/python3.12/site-packages/passlib/context.py:2251: DeprecationWarning: CryptContext.hash(): 'scheme' keyword is deprecated as of Passlib 1.7, and will be removed in Passlib 2.0
    warn("CryptContext.hash(): 'scheme' keyword is deprecated as of "

tests/test_hash.py::test_unicode_regression
tests/test_hash.py::test_invenio_aes_encrypted_email
tests/test_hash.py::test_legacy_user_login
tests/test_hash.py::test_monkey_patch_legacy
  /home/runner/work/invenio-bug-verification/invenio-bug-verification/package-repo/.venv/lib/python3.12/site-packages/passlib/context.py:2270: DeprecationWarning: passing settings to invenio_aes_encrypted_email.hash() is deprecated, and won't be supported in Passlib 2.0; use 'invenio_aes_encrypted_email.using(**settings).hash(secret)' instead
    return self.hash(*args, **kwds)

-- Docs: https://docs.pytest.org/en/stable/how-to/capture-warnings.html
- generated xml file: /home/runner/work/invenio-bug-verification/invenio-bug-verification/artifacts/test-report-patched.xml -
================================ tests coverage ================================
_______________ coverage: platform linux, python 3.12.12-final-0 _______________

Name                                                                                 Stmts   Miss  Cover   Missing
------------------------------------------------------------------------------------------------------------------
invenio_accounts/__init__.py                                                            11      4    64%   47-53
invenio_accounts/admin.py                                                              118      8    93%   77, 197-203
invenio_accounts/alembic/6ec5ce377ca3_create_domains.py                                 18      8    56%   24-85, 92-95
invenio_accounts/alembic/037afe10e9ff_add_user_moderation_fields.py                     14      6    57%   22-26, 31-33
invenio_accounts/alembic/62efc52773d4_create_useridentity_table.py                      11      3    73%   22-36, 46
invenio_accounts/alembic/843bc79c426f_create_accounts_branch.py                          8      0   100%
invenio_accounts/alembic/999dcbd19ace_users_versioning.py                               33     24    27%   24-55, 60-66
invenio_accounts/alembic/9848d0149abd_create_accounts_tables.py                         29     19    34%   25-93, 98-111
invenio_accounts/alembic/dfbdf43a3e96_separate_login_info.py                            26     16    38%   26-59, 65-104
invenio_accounts/alembic/e12419831262_add_new_columns_on_sessionactivity.py             22     14    36%   23-29, 34-40
invenio_accounts/alembic/eb9743315a9d_add_userprofile.py                                20     10    50%   24-64, 71-77
invenio_accounts/alembic/f2522cdd5fcd_change_accountsrole_primary_key_to_string.py      39     28    28%   27-75, 87-132
invenio_accounts/api.py                                                                 40      9    78%   56-58, 62-64, 68-70
invenio_accounts/cli.py                                                                125     14    89%   75, 96-101, 182-189
invenio_accounts/config.py                                                             134      0   100%
invenio_accounts/context_processors/__init__.py                                          0      0   100%
invenio_accounts/context_processors/jwt.py                                              10      0   100%
invenio_accounts/datastore.py                                                           82     23    72%   31-37, 41-46, 90-96, 112, 117, 121, 124-127
invenio_accounts/domains.py                                                             15      3    80%   31-33
invenio_accounts/errors.py                                                               7      2    71%   29-30
invenio_accounts/ext.py                                                                141     23    84%   68, 75, 104-109, 324-325, 335-337, 342-344, 349-360, 368-371, 379-390
invenio_accounts/forms.py                                                               49      6    88%   51, 105-110
invenio_accounts/hash.py                                                                56      0   100%
invenio_accounts/models.py                                                             322     26    92%   213-214, 241, 243-248, 256, 265, 267-272, 280, 308, 461-466, 477-481, 490-491, 496-497
invenio_accounts/profiles/__init__.py                                                    3      0   100%
invenio_accounts/profiles/dicts.py                                                      50      2    96%   54-55
invenio_accounts/profiles/schemas.py                                                    25      0   100%
invenio_accounts/proxies.py                                                             15      0   100%
invenio_accounts/sessions.py                                                            62      2    97%   59, 137
invenio_accounts/signals.py                                                              6      0   100%
invenio_accounts/tasks.py                                                               40     12    70%   59-60, 88-158
invenio_accounts/testutils.py                                                           37      6    84%   115-120, 129
invenio_accounts/utils.py                                                              134      8    94%   93, 144, 160, 248-249, 254-255, 278
invenio_accounts/views/__init__.py                                                       2      0   100%
invenio_accounts/views/rest.py                                                         264     10    96%   73, 173, 260, 262, 315, 349, 417, 419, 463, 553
invenio_accounts/views/security.py                                                      31      2    94%   50, 64
invenio_accounts/views/settings.py                                                      18      0   100%
------------------------------------------------------------------------------------------------------------------
TOTAL                                                                                 2017    288    86%
=========================== short test summary info ============================
ERROR tests/test_invenio_accounts.py::test_kvsession_store_init_with_redis_url - redis.exceptions.ConnectionError: Error 111 connecting to localhost:6380. Connection refused.
======= 244 passed, 4 skipped, 80 warnings, 1 error in 105.95s (0:01:45) =======
 Container docker_services_cli-redis-1  Stopping
 Container docker_services_cli-postgresql-1  Stopping
 Container docker_services_cli-postgresql-1  Stopped
 Container docker_services_cli-postgresql-1  Removing
 Container docker_services_cli-postgresql-1  Removed
 Container docker_services_cli-redis-1  Stopped
 Container docker_services_cli-redis-1  Removing
 Container docker_services_cli-redis-1  Removed
 Network docker_services_cli_default  Removing
 Network docker_services_cli_default  Removed
